{"$defs":{"hash":{"pattern":"^[0-9a-f]{64}$","type":"string"},"nat":{"pattern":"^(0|[1-9][0-9]*)$","type":"string"}},"$id":"https://example.invalid/collatz/branch-certificate-v1.schema.json","$schema":"https://json-schema.org/draft/2020-12/schema","additionalProperties":false,"properties":{"branch_id":{"$ref":"#/$defs/hash"},"config_id":{"$ref":"#/$defs/hash"},"k1":{"pattern":"^[1-9][0-9]*$","type":"string"},"m":{"enum":["92","93","94","95","96"]},"partition_id":{"$ref":"#/$defs/hash"},"partition_sha256":{"$ref":"#/$defs/hash"},"prover_hits":{"$ref":"#/$defs/nat"},"result":{"const":"NO_SURVIVOR"},"root":{"$ref":"https://example.invalid/collatz/work-unit-v1.schema.json#/$defs/root"},"schema":{"const":"collatz.branch-certificate.v1"},"total_input_count":{"$ref":"#/$defs/nat"},"units":{"items":{"additionalProperties":false,"properties":{"prover_result_id":{"$ref":"#/$defs/hash"},"unit_id":{"$ref":"#/$defs/hash"},"verifier_result_id":{"$ref":"#/$defs/hash"}},"required":["prover_result_id","unit_id","verifier_result_id"],"type":"object"},"minItems":1,"type":"array"},"unresolved":{"$ref":"#/$defs/nat"},"verifier_hits":{"$ref":"#/$defs/nat"}},"required":["branch_id","config_id","k1","m","partition_id","partition_sha256","prover_hits","result","root","schema","total_input_count","units","unresolved","verifier_hits"],"title":"Dual-engine certificate for one root branch","type":"object"}
