{"branch_id":"38a522f423c20d1f633c4fc86347ffb28cd74c41655ddec59eb6597d073106c2","config_id":"b95bbdd3004aa0147070166059cccb4b7e0db7a131150f253e6fcb6c6f102098","k1":"29","m":"92","partition_id":"6c17060a0f1fa2f34575952a874cbf45a1fbfa5b76df1e1b20b7a5169bcca194","partition_sha256":"928cf1dcbd88668553a84e4ee2ec3e6b1d301924bb1b6675b9ee5f0f7dd57dc9","prover_hits":"0","result":"NO_SURVIVOR","root":{"bits":"1","count":"13853846509978","first":"4398046511105","last":"32105739531059","residue":"1"},"schema":"collatz.branch-certificate.v1","total_input_count":"13853846509978","units":[{"prover_result_id":"bab5a1fd07c5e2143002837caed54c43544afa14d0760e43328c671ec1272d99","unit_id":"6a3114ef2d3c57454029626cabbab8d9482f65bfd5f032d11cd3692bd279dddb","verifier_result_id":"4813230dd53f992f2bf0a048eabd4adabd112a905e440029586f93ca54f499a7"}],"unresolved":"0","verifier_hits":"0"}
