{"branch_id":"9eaf6f7253a0562acfa4b9cc0f51dc3fa1d9a6591788dca20d434be7bda6ccf6","config_id":"8860c544c8915438469a4eccdd607f7d32afe7d0403a1c7d6a7445159358cead","k1":"21","m":"93","partition_id":"2d28dd58842f12440eb3a28549dd468cec04f64b7023009702367629859d8628","partition_sha256":"6952543d1384ab1f66971d08a53fe0761a713c623a0069405e7667e0ea83ac73","prover_hits":"0","result":"NO_SURVIVOR","root":{"bits":"1","count":"7881299347898368","first":"1125899906842625","last":"16888498602639359","residue":"1"},"schema":"collatz.branch-certificate.v1","total_input_count":"7881299347898368","units":[{"prover_result_id":"0ccf0f651995e93765e3ec8cc9617e0933bd06b4aae1269ff84e972ceead8c3e","unit_id":"7b3c6f1bc2ff658705ae65dba6f78d057f00405b2c9dcb9b96182807b39df0ad","verifier_result_id":"a0a847f83b4e2bc7333ce3f4e1643d8da1488eee3e4fc1f33a957868735e51e7"}],"unresolved":"0","verifier_hits":"0"}
