{"branch_id":"d5376e50ff25b3a38da42f02a69c6590eeb915700ec125c670f4703b44b00b88","config_id":"b95bbdd3004aa0147070166059cccb4b7e0db7a131150f253e6fcb6c6f102098","k1":"50","m":"92","partition_id":"749491da8b359a76ed34918424303bdc0d649258402080ffd0e047d7b3346059","partition_sha256":"172a19153d0105fe6d179561f7ccd5ec635c0bea5971ec12b5074bec40f15cff","prover_hits":"0","result":"NO_SURVIVOR","root":{"bits":"1","count":"6606029","first":"2097153","last":"15309209","residue":"1"},"schema":"collatz.branch-certificate.v1","total_input_count":"6606029","units":[{"prover_result_id":"748d7462eba20250ac539e4b71303044bec3769102fadec87049aff85c178937","unit_id":"20fcf13cdc74ad5361571af3cb4118e8f3c3f6692cfc98bff3609cb03e7e6409","verifier_result_id":"fdd477a73b7cb94f03b98090ff6b5f5f1958a1a10493285756e0782a2963d7d0"}],"unresolved":"0","verifier_hits":"0"}
