{"branch_id":"5e1532592c7e8f6d56e103f97963b4ea8db54f8bd4c5e9247b093fce9eca9dcb","config_id":"d58709ce6b8da2cf7db0de16e3b5dba5f0a760880fd306be9ef1440b39333bd5","k1":"29","m":"95","partition_id":"5091990d5167ff3a3d3897a09514ea3da3c5cea58680346585203316361d6a58","partition_sha256":"7c43966c13fb30c0ad0bbe82459eaf867789bb620bc47152c6b3d7f1e4c3fe3f","prover_hits":"0","result":"NO_SURVIVOR","root":{"bits":"1","count":"50577534877696","first":"4398046511105","last":"105553116266495","residue":"1"},"schema":"collatz.branch-certificate.v1","total_input_count":"50577534877696","units":[{"prover_result_id":"2662a24fb7323245257e4134a8a476da9d686a9d38c69120826bdc64e45950db","unit_id":"7edb76a03ce4e260efe5ba7a2b83fe5f69dc627eb8b0eec9beb64e53ffc629d4","verifier_result_id":"0b983d9330a875429bf692f1fa80986754c7230a2fd667ad6e32f556c8cc9aee"}],"unresolved":"0","verifier_hits":"0"}
