{"branch_id":"57c88d0e21502b4ffc1fc8b27ce5c95feed22ea3177bc6feb580292058950906","config_id":"d58709ce6b8da2cf7db0de16e3b5dba5f0a760880fd306be9ef1440b39333bd5","k1":"16","m":"95","partition_id":"a3546527ad93f2d0ec421af09d4b6b03c975dfe691e504799eb8f3ed2711a61e","partition_sha256":"4d997808a63505ef81e78805eca755114782369c2d18d5ad3eabe52cec1d446c","prover_hits":"0","result":"NO_SURVIVOR","root":{"bits":"1","count":"414331165718085632","first":"36028797018963969","last":"864691128455135231","residue":"1"},"schema":"collatz.branch-certificate.v1","total_input_count":"414331165718085632","units":[{"prover_result_id":"a94fa0fb52851b4c5766cfca4d54cd4b1d7c622809db7220ccdfb0f00596b9c1","unit_id":"f080774a4fcd2496190468be8bea890348eb8e95b8788b8eeb958ddf4c7f7623","verifier_result_id":"202c16ca12609fe6570bec205dc6fe47fc35c3499b0a4257ec6d4e88235ad302"},{"prover_result_id":"d376a6f4fd49992d3ab2987e84052ce6e424a89a6aeebce68547c98fdc389b43","unit_id":"708f4e0a8755aa3884657bfb7a0547705ea507f781861449aed9fdf6caa8cc9a","verifier_result_id":"d8f5db7ffa03e0a7f6275c1963b0d65da07530109c7e2df7d6683890f4ea5105"},{"prover_result_id":"c90055d3b8324b6775a15db5d7f6e42d966227acf6ac68b31135b0b34cc82d3b","unit_id":"e3d7a61dd1199afd1c0d17577b3602df9ccd7fa5d65084ee3bf4dad341d2c619","verifier_result_id":"b75edbd64a9f22b7b3e6d7f3d616e50033ff8027d500d682c38ccc4263ef818e"},{"prover_result_id":"61734d7f6c7d3d5eeb4980872d88486de44a954777a21a8776115d776f42a219","unit_id":"1cb8148aa0e060863966a7979173c5a41b13d4e89011abef4bb41545910f00df","verifier_result_id":"887fc4075b13222ef6378fc1c342a6f7bd1818bba9d6000dfa296604c9113c35"}],"unresolved":"0","verifier_hits":"0"}
