{"branch_id":"dfcd2cfa776bf9526fea160873beeb063b2cb7eda672afdd9871646893939350","config_id":"39358f1f272587ce9bdd2ff4d530f9a9fe079894092f634e6b9e468bc999b419","k1":"72","m":"94","partition_id":"70c7168b3fab443ef3871e0d798da2deeb998b781850a97d62be55e796af03e6","partition_sha256":"2e8c4b32fce8b93267324cb3c6bee8f29c480dfc347c18f95d947cc262b11e4d","prover_hits":"0","result":"NO_SURVIVOR","root":{"bits":"1","count":"6","first":"1","last":"11","residue":"1"},"schema":"collatz.branch-certificate.v1","total_input_count":"6","units":[{"prover_result_id":"19151d17e0749a255073335094082fc975aec46bd784a8d1c9b489a9eb3a6e5a","unit_id":"880a4a88ea1cd423e94a957a7dbfa0399dec4ce4bd286840b40cc1c4d6d93a9f","verifier_result_id":"301cdde160afde120829e5c53660248bd9d888d6957c79a877958205a6ef2ee5"}],"unresolved":"0","verifier_hits":"0"}
