{"branch_id":"1508bb69224b38c393f3da3a7d86b5c65f705c7469a064cea2925d4503f6e0dc","config_id":"d58709ce6b8da2cf7db0de16e3b5dba5f0a760880fd306be9ef1440b39333bd5","k1":"41","m":"95","partition_id":"db1273f059c9eec3a81b01b0551fff7e20655560a0d5fcca1242213dcbe34996","partition_sha256":"fddc3c9f6831074296d30122b8c069e623b071f121d18753a6e8df919bb3dda2","prover_hits":"0","result":"NO_SURVIVOR","root":{"bits":"1","count":"12348030976","first":"1073741825","last":"25769803775","residue":"1"},"schema":"collatz.branch-certificate.v1","total_input_count":"12348030976","units":[{"prover_result_id":"2da41bf6d05cd4d372fe792ec6c86da9d91cf90cb5dc072a039c0a602ace755a","unit_id":"66e65fad2457d934db85817aa2f2633971d3b7effc336aa9069391d3be8b8d9f","verifier_result_id":"eb074c333a915e056e675bbec739a92c2ea3f297317047a5ad7de11080f425aa"}],"unresolved":"0","verifier_hits":"0"}
