{"branch_id":"3d56e819f91b6f6b1ce486873b6cb928482aac8fe1a92df64656008162782571","config_id":"7add73f82f81f6cd6a848b0c782c7e7344740c535af7a7de8166a6e7a046de1d","k1":"75","m":"96","partition_id":"9b9972f64a3235d171c23c3dcafae173064b3b8bc16cae1ea3dfbe99c55a211d","partition_sha256":"d0942f7b6021f1c1da51ef90a019d23a2384a5e94b0ae9d18dbad99533456073","prover_hits":"0","result":"NO_SURVIVOR","root":{"bits":"1","count":"1","first":"1","last":"1","residue":"1"},"schema":"collatz.branch-certificate.v1","total_input_count":"1","units":[{"prover_result_id":"3f99e9c764693a23f396a6ca6d9a8f9baaed6e7c95477c77217605bd49237634","unit_id":"d0bd6ebe3a9e3e3f6086483edb4eb487b644bba0e3c2b0ad7cef683d7686e169","verifier_result_id":"4e632a116c61708cc8fd95e7744b08af9cfba019e5b213043cf2b1cd7a79a723"}],"unresolved":"0","verifier_hits":"0"}
