{"branch_id":"30acf33ff982a37ef8c9a965f1020f64c0e048fc7403bc6159f17ecad025b628","config_id":"7add73f82f81f6cd6a848b0c782c7e7344740c535af7a7de8166a6e7a046de1d","k1":"35","m":"96","partition_id":"2d93b4b14bb6d623ba221dbb2194c12d7bb94a99ae46d0539aef190dcaab65d4","partition_sha256":"0fa64cd5319b35ea334a3d5229ae4226ee4331582e8a14e648834678f953a663","prover_hits":"0","result":"NO_SURVIVOR","root":{"bits":"1","count":"962072674304","first":"68719476737","last":"1992864825343","residue":"1"},"schema":"collatz.branch-certificate.v1","total_input_count":"962072674304","units":[{"prover_result_id":"e0e3c9a2e6b0c75c02e164904484ae72fe299981ff5b4c15620fe1938d36ec85","unit_id":"82df207a77021c40b7be69a74c1453ea676338d87d7983b9e7180e42124dced1","verifier_result_id":"6baf7aa6749ef3f65c09eba8a90dd4e60b09d59a0fc002917127330fb97d1526"},{"prover_result_id":"cb3a782b31a41df99ae82c89af24daea28aec50679dabcb10382d1e2324b7b90","unit_id":"e2fa4b48cad8687f9c78156264b63ed3390396877a7a246fbd2d0b6f140a4d4d","verifier_result_id":"9496fc068b3e8bc26b85ae85d98b8592d465a1fc4e3795fa77714d62a3f4a3b0"}],"unresolved":"0","verifier_hits":"0"}
