{"branch_id":"5cfb69a4c67c1fc5114b0afa56470808fcb36b83086893385b625005309f9bcc","config_id":"7add73f82f81f6cd6a848b0c782c7e7344740c535af7a7de8166a6e7a046de1d","k1":"43","m":"96","partition_id":"599abdf4c5e507231a0963ced57c7aa5d0d246e74f301215829d5f017cd8d996","partition_sha256":"45b65a39598231c4ef0641788fb97474b180744158821360f3703ebd1651a5a6","prover_hits":"0","result":"NO_SURVIVOR","root":{"bits":"1","count":"3758096384","first":"268435457","last":"7784628223","residue":"1"},"schema":"collatz.branch-certificate.v1","total_input_count":"3758096384","units":[{"prover_result_id":"c0d81ca8292cce70966629423cd1067a7461877d5a5105c6d7679dc40194b295","unit_id":"06db3c23f86befae332c79e49e0881661a2ca76bca0f01965fc49358350e2e14","verifier_result_id":"91795948d7e009b45cbc26c62a9c851bfe7619b3c485c445df0040823a331f05"}],"unresolved":"0","verifier_hits":"0"}
