{"branch_id":"880778ec3f5339583bcdde00ec2d1c3bf125bdeff4c68f41cca330cdb9a5e3d7","config_id":"d58709ce6b8da2cf7db0de16e3b5dba5f0a760880fd306be9ef1440b39333bd5","k1":"67","m":"95","partition_id":"9d3ffd41f0ceb7437e5ac25256255cbe1862bf112f2f01f68c17d5a77a624976","partition_sha256":"2ff533c735f86f3cfba33d5e2c05f60c05047eab04d44784e2f4c58f8d628778","prover_hits":"0","result":"NO_SURVIVOR","root":{"bits":"1","count":"184","first":"17","last":"383","residue":"1"},"schema":"collatz.branch-certificate.v1","total_input_count":"184","units":[{"prover_result_id":"857f5160f9d7a3f9138eebc4c849326c5315bf4a91cf04a396af4399130dd3fa","unit_id":"d61fa2ff4988cbe30958314b336db87c7c5395fa1855f53e0d2ee045e74ab912","verifier_result_id":"1dd74c8b914e806540e78ff253574ed34d84ec577d02939c22fac65d6b34479a"}],"unresolved":"0","verifier_hits":"0"}
