{"branch_id":"798a548ec44376830db2ec6a6fc706c15aa824f9bd961bf0062e31e91dcb4b49","config_id":"39358f1f272587ce9bdd2ff4d530f9a9fe079894092f634e6b9e468bc999b419","k1":"35","m":"94","partition_id":"94d88e7d74245ec51524ba59abab81a0fdc1405dce306adb75a9a1b600d54e2e","partition_sha256":"0115af7ee8b456fd06f86fee50182939502a195d27ff5af92e8d65c8d6ec7ffa","prover_hits":"0","result":"NO_SURVIVOR","root":{"bits":"1","count":"790273982464","first":"68719476737","last":"1649267441663","residue":"1"},"schema":"collatz.branch-certificate.v1","total_input_count":"790273982464","units":[{"prover_result_id":"0be4fd158845cee7d1d4ea989fecd92f669508c52ad7ba780d4a8dc7989d5141","unit_id":"2a46a58f9f5ed997d9eb8890b0c799484be8eae6eabb276a5ad2ca69bb9c7c0e","verifier_result_id":"58f94a92b9c05e38b755bca854902af6c90bad3529b336047144e99832071be2"}],"unresolved":"0","verifier_hits":"0"}
