{"branch_id":"739a230d179a968815185beb369888ca2c3aaa78c96dfe004dd636d6f1b3a327","config_id":"39358f1f272587ce9bdd2ff4d530f9a9fe079894092f634e6b9e468bc999b419","k1":"47","m":"94","partition_id":"d9755060611aedded84a4b67972a9ccec7e2f424bc0adb6bbf4122d3630f5bde","partition_sha256":"7dd101da0307d123d2039bf3c676b2b0c088aa319ce676a7305a64745e029acc","prover_hits":"0","result":"NO_SURVIVOR","root":{"bits":"1","count":"192937984","first":"16777217","last":"402653183","residue":"1"},"schema":"collatz.branch-certificate.v1","total_input_count":"192937984","units":[{"prover_result_id":"03c745a7ec30f7c57609e6844202c0bf86c79461521d9dae8ce72c7fa28a1fd3","unit_id":"cbc9e873b68fe242cefa555982374944b916c89f466bc2079e5c8eb521597b41","verifier_result_id":"695f0c04ec9c2ccf41047a21fbf30a5a6d36ff284c9666b269cfa5dcc869bc07"}],"unresolved":"0","verifier_hits":"0"}
