{"branch_id":"18bd1af21e43f5e60178d6d1c930a349a8a4f32aff0118092e5f1cb5c76429da","config_id":"d58709ce6b8da2cf7db0de16e3b5dba5f0a760880fd306be9ef1440b39333bd5","k1":"57","m":"95","partition_id":"159f7a45f27b14021501d42376caf3d90e9aa3bf118d5bd2647c9e2b392b1852","partition_sha256":"715dc88058a59544caed442c4cf3455a6ef5437ad4704ac407e71c25eda04ba7","prover_hits":"0","result":"NO_SURVIVOR","root":{"bits":"1","count":"188416","first":"16385","last":"393215","residue":"1"},"schema":"collatz.branch-certificate.v1","total_input_count":"188416","units":[{"prover_result_id":"e1888ffb304e4bca1ed72da3f1f1292071e1d33112b7f15b53d825919653cabf","unit_id":"952fc24f4a200642097f5749a79f2282475aa767298595d91d410814fb98e1c2","verifier_result_id":"2821f521bcf1e2a6ef10e0d5aa0130b7fadd6614a5a45a3b547577b8edcb1c72"}],"unresolved":"0","verifier_hits":"0"}
