{"branch_id":"4ac40e7a991794ecddca2cbd28ff9d17d99d5b33d90f16d73be36286dce2d54e","config_id":"8860c544c8915438469a4eccdd607f7d32afe7d0403a1c7d6a7445159358cead","k1":"9","m":"93","partition_id":"1d09c3ddf838faf33ea6db27485a9a1f80959c521973de605bc055280e88ff4d","partition_sha256":"5545de15c3a04a3db46fe520623bf3038e3843a02b92c0dbdb6764a77ff12b45","prover_hits":"0","result":"NO_SURVIVOR","root":{"bits":"1","count":"32281802128991715328","first":"4611686018427387905","last":"69175290276410818559","residue":"1"},"schema":"collatz.branch-certificate.v1","total_input_count":"32281802128991715328","units":[{"prover_result_id":"0a020951f8cc3392366a6bac6c054d091134069e0d4df4fc927cd6e2bb18f7d1","unit_id":"54316ac2db71584d04e086087e8692bb7a7a98c88220279e24fafb27eb6b77f3","verifier_result_id":"6a63f2327bdc53317c9e7996273df647a288fe3aae43d9f14375656931d20282"}],"unresolved":"0","verifier_hits":"0"}
