{"branch_id":"a72c325e53f70fed9a22b4c3ee28365a09939019fcc540afea0393ceec6bd299","config_id":"b95bbdd3004aa0147070166059cccb4b7e0db7a131150f253e6fcb6c6f102098","k1":"19","m":"92","partition_id":"56ae3c0039242ca1a14b426f1837f7bdaabab64da5530e61c4edfeb4d6cd2b47","partition_sha256":"43b4201f33d7d602d451643d0e0b2a7e769f694bd062e782a6a2840803ed5981","prover_hits":"0","result":"NO_SURVIVOR","root":{"bits":"1","count":"14186338826217062","first":"4503599627370497","last":"32876277279804619","residue":"1"},"schema":"collatz.branch-certificate.v1","total_input_count":"14186338826217062","units":[{"prover_result_id":"09371aa5434d40c2284d7252a450358069b847000d0cef9482d3a6a01944a901","unit_id":"80b607d0ac266c27039b99d4309c0703c2569200748a23c07b16fdf81d0c5acf","verifier_result_id":"dcfe5eea4ad5064d0da36f545865614382eae3a6db731fbae9e1a3f2d967ecd7"}],"unresolved":"0","verifier_hits":"0"}
