{"branch_id":"d352732c5bf833124bfdb8209a6d625e6260b81c073d3b10f6e512448434c241","config_id":"39358f1f272587ce9bdd2ff4d530f9a9fe079894092f634e6b9e468bc999b419","k1":"31","m":"94","partition_id":"3552ea7a6e908a027a5871d1e976805b7afca9fcb8bd68721554d0674e3a6aa3","partition_sha256":"5439994d0b7731ee9604cfdc7dc11d783db693f0258dbeeca38775878cf31910","prover_hits":"0","result":"NO_SURVIVOR","root":{"bits":"1","count":"12644383719424","first":"1099511627777","last":"26388279066623","residue":"1"},"schema":"collatz.branch-certificate.v1","total_input_count":"12644383719424","units":[{"prover_result_id":"251e3c8d6179f14276f785d33b05daf2bbbe4a7cef819cbbc7b181cac27bf2d9","unit_id":"51f73f56d0dcb1ac23696216d7a2340065d738c0b83de5cba2a2db00a3445551","verifier_result_id":"a83de2d6fd06ff0a5eadd0b7ea4f38fc077b24401af491dc1278f2a412edf860"}],"unresolved":"0","verifier_hits":"0"}
