{"branch_id":"e12eecb837df8485818f21fd920fc607e7e3115a827203f34b582c4570b48480","config_id":"8860c544c8915438469a4eccdd607f7d32afe7d0403a1c7d6a7445159358cead","k1":"66","m":"93","partition_id":"e0b11b483dbd56f9891f92b202eda7dda66f2616c2f897a9e43f2516207ed5fc","partition_sha256":"74d807cb6959239d3d1f7d76ee11da94aa0385b70cb597d81b63fa0c57234713","prover_hits":"0","result":"NO_SURVIVOR","root":{"bits":"1","count":"224","first":"33","last":"479","residue":"1"},"schema":"collatz.branch-certificate.v1","total_input_count":"224","units":[{"prover_result_id":"9292f3f204f185e8d432092dd5e6a4f98f0b9bb60a494f443e7239ffa1ef51c8","unit_id":"327d6f893297460a82a08e56f024661f3022816376af3e4fdb594d893076c5ee","verifier_result_id":"22d7152a06cc221e8c468732d328fe854176534f5d1b899de87698727efc05ff"}],"unresolved":"0","verifier_hits":"0"}
