{"branch_id":"fa8cff01474593ed95bddceca0717927b0ab192c509bf255073590b87a1dfc67","config_id":"8860c544c8915438469a4eccdd607f7d32afe7d0403a1c7d6a7445159358cead","k1":"23","m":"93","partition_id":"fa9903fb144df9191f424b7e957af019ea3e0d01ffe95614d2600c575bb29574","partition_sha256":"dde9e6674b9039eb9285e7621fe9cc49de7ff7b6710ea46587d87caf40d5de48","prover_hits":"0","result":"NO_SURVIVOR","root":{"bits":"1","count":"1970324836974592","first":"281474976710657","last":"4222124650659839","residue":"1"},"schema":"collatz.branch-certificate.v1","total_input_count":"1970324836974592","units":[{"prover_result_id":"7d117815fedf85816fe4734719933708c29544a75e5650eb3015a54a2d2d6cbf","unit_id":"4c9a776db6267bbe1d5e4250f3b232d78b99a0f11c4b28d93cbc98ba37827159","verifier_result_id":"ae70453a0f76a49c2d97f3fa7cf4c87b5b406c47b97f8bc49975e13fec404fa4"}],"unresolved":"0","verifier_hits":"0"}
