{"branch_id":"03b6769cbf048c17de9f575dec8dc87ddff05e4869a8999ee67c7cadb819466c","config_id":"b95bbdd3004aa0147070166059cccb4b7e0db7a131150f253e6fcb6c6f102098","k1":"7","m":"92","partition_id":"9a9477d9f58af9d634d2c9b70fccaba201c470dac2bf8991d652849eff1f4141","partition_sha256":"d5b9c5d3db3b9188e09b32d5eb3815d5381a2f0b85dedabfc9a56cbdb2407e27","prover_hits":"0","result":"NO_SURVIVOR","root":{"bits":"1","count":"58107243832185087590","first":"18446744073709551617","last":"134661231738079726795","residue":"1"},"schema":"collatz.branch-certificate.v1","total_input_count":"58107243832185087590","units":[{"prover_result_id":"948684e9a3618f515adfa34a46e1e3c13c36494c90fd8ff6750ffb166d506a5d","unit_id":"2e47fffcba4ad29ca9d4055558e450c8585bf6eb3e398763f1bff434248b9df4","verifier_result_id":"6915e02b88ada91db2b781eac29ed7a87a1fcf10b8b7e54daafb3d9b3e06c11a"}],"unresolved":"0","verifier_hits":"0"}
