{"branch_id":"6836bf7442f27e96db1833acbf9ed82f0df105f0dcd0db0073a3ad561a41e59a","config_id":"7add73f82f81f6cd6a848b0c782c7e7344740c535af7a7de8166a6e7a046de1d","k1":"28","m":"96","partition_id":"8c0d37b62b1f91ab1bf247f6cfa0c42be70b33654c65488a530513423dc8976f","partition_sha256":"d38d4bdc7ebbba14c53daf9bdbb91f98027c445c16f69fd67c2f8e42ab2bcd0e","prover_hits":"0","result":"NO_SURVIVOR","root":{"bits":"1","count":"123145302310912","first":"8796093022209","last":"255086697644031","residue":"1"},"schema":"collatz.branch-certificate.v1","total_input_count":"123145302310912","units":[{"prover_result_id":"cc01be40841b93962567095fd5b0e3eec999e6f1883d5eaa7af57597409c1f7d","unit_id":"8bf173743506d18c88b4af58f80fdec0e0abecc91dbfcbc1a71bf75497ecf047","verifier_result_id":"3e0ea89cd4650958715805df0820ad7c5d1c0c7f3b69feb7547743af24b7b275"},{"prover_result_id":"de8cc9ddfea2c6dcaf9b7ccc2813960d8c683e92ec7798c802558cefa51e73a3","unit_id":"5f8b54d4bd9ecb884f782302881db9fadd2a491942dd57b8134d824e9351a662","verifier_result_id":"eb69df9101123e8f8f443cef434e7847dc4565cb5bd492f492abf6c25ad7a035"}],"unresolved":"0","verifier_hits":"0"}
