{"branch_id":"5af54e4a7e12469d4deab9b20764570889e6b7eae5376880eab0ece2effb9eff","config_id":"39358f1f272587ce9bdd2ff4d530f9a9fe079894092f634e6b9e468bc999b419","k1":"60","m":"94","partition_id":"08e897f19503941709b86984134bf44821437ffeed958fec064b150e49f20c39","partition_sha256":"7a9e13c37b7cdffb1c30771a916930195f7a2fcba8bb4af16edd5f134d351b0d","prover_hits":"0","result":"NO_SURVIVOR","root":{"bits":"1","count":"23552","first":"2049","last":"49151","residue":"1"},"schema":"collatz.branch-certificate.v1","total_input_count":"23552","units":[{"prover_result_id":"85bc8982b8aec660a7b0e8ce3b5e4c9b31c0d12ffcc3867bc7d137ef6dccb0fb","unit_id":"3aff80978cdf5a3c1862cb84c3d507261db878889aa54dc59eb858f9df25d399","verifier_result_id":"9cf427a91422cc55ecf19a2ce3f972c1088bf6bcb83bd28044f66523354c0ab2"}],"unresolved":"0","verifier_hits":"0"}
