{"branch_id":"56c2f45684051083551c2ce90b32f9bd3702709b8dff344a6bbcae54e9193288","config_id":"d58709ce6b8da2cf7db0de16e3b5dba5f0a760880fd306be9ef1440b39333bd5","k1":"31","m":"95","partition_id":"16a4196672c8c6f885f225939e946a22db6392a9ce2f4445d44f6cce08168ba3","partition_sha256":"9013f24d1d5684fb9d14da746a1e6b492eccabd1a4b53ca8914029e26581fada","prover_hits":"0","result":"NO_SURVIVOR","root":{"bits":"1","count":"12644383719424","first":"1099511627777","last":"26388279066623","residue":"1"},"schema":"collatz.branch-certificate.v1","total_input_count":"12644383719424","units":[{"prover_result_id":"dc5bc247e5166a0a1b08c45e19bf52fbcf3ca355d5277fc7c16c6173fbda9d2b","unit_id":"99e4d0c639762c54e7c014913c5b70bf3ebcd3f138f462092954bdebd93b38dd","verifier_result_id":"64c2a3b5cdd19397cf50550843e64356ab8f939ebcd8c3099152266b1977ea11"}],"unresolved":"0","verifier_hits":"0"}
