{"branch_id":"dabd14ba7f5b139c291b39028d02874e198bed1b8877f92348b60713bc94412d","config_id":"7add73f82f81f6cd6a848b0c782c7e7344740c535af7a7de8166a6e7a046de1d","k1":"16","m":"96","partition_id":"78708e4b8e0cd39186b61a1a8bc1b1dc703af8072eb68acd6ea002efb99d09e7","partition_sha256":"5d4134d8d2ccd2408d91f9001cbbc61bf4f1bba262fe65747ac5e5cae6778dc4","prover_hits":"0","result":"NO_SURVIVOR","root":{"bits":"1","count":"504403158265495552","first":"36028797018963969","last":"1044835113549955071","residue":"1"},"schema":"collatz.branch-certificate.v1","total_input_count":"504403158265495552","units":[{"prover_result_id":"88fa0b95f8e50ed46a0ff15ded524cb0367314fb59a959b233a0faff28362732","unit_id":"124b0608f76bf55e3a467937d3a37d18b894d2a02d1a99fa59b9ef7863a5df83","verifier_result_id":"db280cd923ca5471252c69ef09e026259af8afe7c54d80025f9f9ba73de1a1e7"},{"prover_result_id":"75a9fcfa8bd5bb67bbb9a854dd902a0d0b9881f469c60f8d665c9d6561f52cad","unit_id":"985ae3c83d603c1d5f2957b33cfb2eabbceb5b1d5e13d0c0403c594d1245ffaf","verifier_result_id":"b69e94f141262bcbff47e9ededa3e3a0f0e64d7283e2913aaf5ade33e58ac829"}],"unresolved":"0","verifier_hits":"0"}
